{
  "$schema": "../schemas/product.schema.json",
  "id": "comfort-colors-1717",
  "brand": "Comfort Colors",
  "model": "1717",
  "name": "Comfort Colors 1717 Garment-Dyed Heavyweight T-Shirt",
  "printMethod": "dtg",
  "printAreas": [],
  "colors": [
    {
      "name": "Banana",
      "slug": "banana",
      "hex": "#ffecb9",
      "aliases": [],
      "family": "orange-yellow",
      "source": "printify",
      "sourceDate": "2026-09-24",
      "image": {
        "url": "https://pub-d11811fd2aeb4e4c8f77b5b259d703a7.r2.dev/mockup-templates/e97a508f-527f-4291-93f4-523959d5680f/versions/92129b1c-30db-424b-b0d6-ee3bcdb96a3d/colors/photographic-codex-v2-unmasked-codex-gpt-image-2/candidates/121712d5c1aff79b695f0454f625fd00076a33b1b6f6b4de493d303173849242.png",
        "sha256": "121712d5c1aff79b695f0454f625fd00076a33b1b6f6b4de493d303173849242"
      },
      "pod": {
        "colorAssetVersionId": "84c1cddb-9730-495f-88d0-b119110a33b7"
      }
    },
    {
      "name": "Bay",
      "slug": "bay",
      "hex": "#aeb5ac",
      "aliases": [],
      "family": "neutral",
      "source": "reviewed",
      "sourceDate": "2026-09-24",
      "image": {
        "url": "https://pub-d11811fd2aeb4e4c8f77b5b259d703a7.r2.dev/mockup-templates/e97a508f-527f-4291-93f4-523959d5680f/versions/92129b1c-30db-424b-b0d6-ee3bcdb96a3d/colors/photographic-codex-v2-unmasked-codex-gpt-image-2/candidates/19668c23c54d585f0f4139c9e442e7ed0a49e5666125a19f951d89ccc6da8113.png",
        "sha256": "19668c23c54d585f0f4139c9e442e7ed0a49e5666125a19f951d89ccc6da8113"
      },
      "pod": {
        "colorAssetVersionId": "d47d7f26-a6e0-44ff-9b2b-34b5d092bd9f"
      },
      "sourceNote": "Reviewed by Jill against the POD garment render on 2026-09-24 (INT-2260); sampled from the render. Printify value was #c3cfc1."
    },
    {
      "name": "Berry",
      "slug": "berry",
      "hex": "#844e64",
      "aliases": [],
      "family": "red-pink",
      "source": "reviewed",
      "sourceDate": "2026-09-24",
      "image": {
        "url": "https://pub-d11811fd2aeb4e4c8f77b5b259d703a7.r2.dev/mockup-templates/e97a508f-527f-4291-93f4-523959d5680f/versions/92129b1c-30db-424b-b0d6-ee3bcdb96a3d/colors/photographic-codex-v2-unmasked-codex-gpt-image-2/candidates/b9402c4fed8bbd35a9adf61db3f032f6d7169a18e4cf79452a2f2423f2ac7bf5.png",
        "sha256": "b9402c4fed8bbd35a9adf61db3f032f6d7169a18e4cf79452a2f2423f2ac7bf5"
      },
      "pod": {
        "colorAssetVersionId": "a3df43c2-9e4f-4f02-a8e4-167d13abcfbf"
      },
      "sourceNote": "Reviewed by Jill against the POD garment render on 2026-09-24 (INT-2260); sampled from the render. Printify value was #875570."
    },
    {
      "name": "Black",
      "slug": "black",
      "hex": "#1f1d1e",
      "aliases": [],
      "family": "neutral",
      "source": "reviewed",
      "sourceDate": "2026-09-24",
      "image": {
        "url": "https://pub-d11811fd2aeb4e4c8f77b5b259d703a7.r2.dev/mockup-templates/e97a508f-527f-4291-93f4-523959d5680f/versions/92129b1c-30db-424b-b0d6-ee3bcdb96a3d/colors/photographic-codex-v2-unmasked-codex-gpt-image-2/candidates/b4873d9a3deb7d5d25cc13b11f6d94f4796c930fa6d4655bb832be068687d38f.png",
        "sha256": "b4873d9a3deb7d5d25cc13b11f6d94f4796c930fa6d4655bb832be068687d38f"
      },
      "pod": {
        "colorAssetVersionId": "8d03644d-5f6b-4098-ba8a-224a2c0078ed"
      },
      "sourceNote": "Reviewed by Jill against the POD garment render on 2026-09-24 (INT-2260); sampled from the render. Printify value was #000000."
    },
    {
      "name": "Blossom",
      "slug": "blossom",
      "hex": "#f8d1e2",
      "aliases": [],
      "family": "red-pink",
      "source": "printify",
      "sourceDate": "2026-09-24",
      "image": {
        "url": "https://pub-d11811fd2aeb4e4c8f77b5b259d703a7.r2.dev/mockup-templates/e97a508f-527f-4291-93f4-523959d5680f/versions/92129b1c-30db-424b-b0d6-ee3bcdb96a3d/colors/photographic-codex-v2-unmasked-codex-gpt-image-2/candidates/bca1dbe307d6d6ad8a8f13361c699a4d2e5207973ab77987acdb3d9347062c87.png",
        "sha256": "bca1dbe307d6d6ad8a8f13361c699a4d2e5207973ab77987acdb3d9347062c87"
      },
      "pod": {
        "colorAssetVersionId": "3c168dbb-159d-4b90-9130-6b9b6e041073"
      }
    },
    {
      "name": "Blue Jean",
      "slug": "blue-jean",
      "hex": "#636d82",
      "aliases": [],
      "family": "blue",
      "source": "printify",
      "sourceDate": "2026-09-24",
      "image": {
        "url": "https://pub-d11811fd2aeb4e4c8f77b5b259d703a7.r2.dev/mockup-templates/e97a508f-527f-4291-93f4-523959d5680f/versions/92129b1c-30db-424b-b0d6-ee3bcdb96a3d/colors/photographic-codex-v2-unmasked-codex-gpt-image-2/candidates/1e9802d927ecc3ea4bdec23220b3c97cd8faf44ca345ff40db56830d327a068c.png",
        "sha256": "1e9802d927ecc3ea4bdec23220b3c97cd8faf44ca345ff40db56830d327a068c"
      },
      "pod": {
        "colorAssetVersionId": "1243c57a-d3a4-420f-96a2-81faa9c7d3bc"
      }
    },
    {
      "name": "Blue Spruce",
      "slug": "blue-spruce",
      "hex": "#536758",
      "aliases": [],
      "family": "green",
      "source": "printify",
      "sourceDate": "2026-09-24",
      "image": {
        "url": "https://pub-d11811fd2aeb4e4c8f77b5b259d703a7.r2.dev/mockup-templates/e97a508f-527f-4291-93f4-523959d5680f/versions/92129b1c-30db-424b-b0d6-ee3bcdb96a3d/colors/photographic-codex-v2-unmasked-codex-gpt-image-2/candidates/66619371fe762cd0054848af2d6a3107d147019652fd8b5b2a5b21d8b01c7841.png",
        "sha256": "66619371fe762cd0054848af2d6a3107d147019652fd8b5b2a5b21d8b01c7841"
      },
      "pod": {
        "colorAssetVersionId": "7925cedd-d7d7-4aac-9585-beabe36160d9"
      }
    },
    {
      "name": "Brick",
      "slug": "brick",
      "hex": "#914a4a",
      "aliases": [],
      "family": "red-pink",
      "source": "printify",
      "sourceDate": "2026-09-24",
      "image": {
        "url": "https://pub-d11811fd2aeb4e4c8f77b5b259d703a7.r2.dev/mockup-templates/e97a508f-527f-4291-93f4-523959d5680f/versions/92129b1c-30db-424b-b0d6-ee3bcdb96a3d/colors/photographic-codex-v2-unmasked-codex-gpt-image-2/candidates/27d86903ef1c12cf4db718e9a6e238e59ba2e6c6e1d416377bb886faee1a1433.png",
        "sha256": "27d86903ef1c12cf4db718e9a6e238e59ba2e6c6e1d416377bb886faee1a1433"
      },
      "pod": {
        "colorAssetVersionId": "c799836d-b026-4c17-8248-1d997be94516"
      }
    },
    {
      "name": "Bright Orange",
      "slug": "bright-orange",
      "hex": "#fa8b2b",
      "aliases": [],
      "family": "orange-yellow",
      "source": "reviewed",
      "sourceDate": "2026-09-24",
      "image": {
        "url": "https://pub-d11811fd2aeb4e4c8f77b5b259d703a7.r2.dev/mockup-templates/e97a508f-527f-4291-93f4-523959d5680f/versions/92129b1c-30db-424b-b0d6-ee3bcdb96a3d/colors/photographic-codex-v2-unmasked-codex-gpt-image-2/candidates/01cf1300c74fe09571c7354507578aab3ced6f4fd9d9e59fe6715bcce91fa000.png",
        "sha256": "01cf1300c74fe09571c7354507578aab3ced6f4fd9d9e59fe6715bcce91fa000"
      },
      "pod": {
        "colorAssetVersionId": "2bc0edd1-9ee6-4ebc-b23f-a3ccbb28f3fb"
      },
      "sourceNote": "Reviewed by Jill against the POD garment render on 2026-09-24 (INT-2260); sampled from the render. Printify value was #ffad4f."
    },
    {
      "name": "Bright Salmon",
      "slug": "bright-salmon",
      "hex": "#ff6b50",
      "aliases": [],
      "family": "red-pink",
      "source": "printify",
      "sourceDate": "2026-09-24",
      "image": {
        "url": "https://pub-d11811fd2aeb4e4c8f77b5b259d703a7.r2.dev/mockup-templates/e97a508f-527f-4291-93f4-523959d5680f/versions/92129b1c-30db-424b-b0d6-ee3bcdb96a3d/colors/photographic-codex-v2-unmasked-codex-gpt-image-2/candidates/ff3e565cf56519419f899383328c31f6179e35b4781c0001a6bc4ff2153236ad.png",
        "sha256": "ff3e565cf56519419f899383328c31f6179e35b4781c0001a6bc4ff2153236ad"
      },
      "pod": {
        "colorAssetVersionId": "b5290867-49c2-4ceb-9d00-5b9e48002daa"
      }
    },
    {
      "name": "Burnt Orange",
      "slug": "burnt-orange",
      "hex": "#e27c4b",
      "aliases": [],
      "family": "orange-yellow",
      "source": "printify",
      "sourceDate": "2026-09-24",
      "image": {
        "url": "https://pub-d11811fd2aeb4e4c8f77b5b259d703a7.r2.dev/mockup-templates/e97a508f-527f-4291-93f4-523959d5680f/versions/92129b1c-30db-424b-b0d6-ee3bcdb96a3d/colors/photographic-codex-v2-unmasked-codex-gpt-image-2/candidates/62bb4a521f288f265ebd73b410dc185ee4ad74aa90e06f629119e0e87fb7be19.png",
        "sha256": "62bb4a521f288f265ebd73b410dc185ee4ad74aa90e06f629119e0e87fb7be19"
      },
      "pod": {
        "colorAssetVersionId": "87db8353-521d-4aaf-892d-3c49deed9149"
      }
    },
    {
      "name": "Butter",
      "slug": "butter",
      "hex": "#f5e1a4",
      "aliases": [],
      "family": "orange-yellow",
      "source": "printify",
      "sourceDate": "2026-09-24",
      "image": {
        "url": "https://pub-d11811fd2aeb4e4c8f77b5b259d703a7.r2.dev/mockup-templates/e97a508f-527f-4291-93f4-523959d5680f/versions/92129b1c-30db-424b-b0d6-ee3bcdb96a3d/colors/photographic-codex-v2-unmasked-codex-gpt-image-2/candidates/e3209d149c2575234bc9bc57221aac1bc85845066dfac37ed8fb377c196347c4.png",
        "sha256": "e3209d149c2575234bc9bc57221aac1bc85845066dfac37ed8fb377c196347c4"
      },
      "pod": {
        "colorAssetVersionId": "b65e32eb-66e4-490a-8718-fb8c7c6cd9a4"
      }
    },
    {
      "name": "Chalky Mint",
      "slug": "chalky-mint",
      "hex": "#a7dcd4",
      "aliases": [],
      "family": "green",
      "source": "printify",
      "sourceDate": "2026-09-24",
      "image": {
        "url": "https://pub-d11811fd2aeb4e4c8f77b5b259d703a7.r2.dev/mockup-templates/e97a508f-527f-4291-93f4-523959d5680f/versions/92129b1c-30db-424b-b0d6-ee3bcdb96a3d/colors/photographic-codex-v2-unmasked-codex-gpt-image-2/candidates/637ba52881954d767674b12e94400471f874690ea20b65c0a3ac7996cda501af.png",
        "sha256": "637ba52881954d767674b12e94400471f874690ea20b65c0a3ac7996cda501af"
      },